{
  "$schema": "https://json-schema.org/draft/2020-12/schema",
  "$id": "https://wefter.dev/schemas/product-shaping-profile.schema.json",
  "type": "object",
  "required": ["version", "workflowName", "variants", "lenses"],
  "properties": {
    "version": { "const": 1 },
    "workflowName": { "const": "product-shaping" },
    "variants": {
      "type": "array",
      "minItems": 1,
      "items": {
        "type": "object",
        "required": ["id", "title", "instruction"],
        "properties": {
          "id": { "type": "string", "pattern": "^[a-z0-9][a-z0-9-]*$" },
          "title": { "type": "string", "minLength": 1 },
          "instruction": { "type": "string", "minLength": 1 }
        },
        "additionalProperties": false
      }
    },
    "lenses": {
      "type": "array",
      "minItems": 1,
      "items": {
        "type": "object",
        "required": ["id", "title", "focus"],
        "properties": {
          "id": { "type": "string", "pattern": "^[a-z0-9][a-z0-9-]*$" },
          "title": { "type": "string", "minLength": 1 },
          "focus": { "type": "string", "minLength": 1 }
        },
        "additionalProperties": false
      }
    }
  },
  "additionalProperties": false
}
