{
  "version": 1,
  "workflowName": "product-shaping",
  "variants": [
    {
      "id": "source-traceability",
      "title": "Source traceability",
      "instruction": "Find product ideas, requirements, scope items, domain rules or deliverables that lack traceability to source materials, market references or recorded product decisions."
    },
    {
      "id": "scope-and-boundary",
      "title": "Scope and boundary",
      "instruction": "Find places where vision, feature catalog, roadmap, release scope, domain spec, acceptance criteria or deliverables overreach their documented responsibility."
    },
    {
      "id": "decision-and-question-gates",
      "title": "Decision and question gates",
      "instruction": "Find unresolved questions, proposed decisions, ambiguous domain behavior or scope choices that should block release readiness or delivery handoff."
    },
    {
      "id": "handoff-readiness",
      "title": "Handoff readiness",
      "instruction": "Find deliverables that are too broad, too task-like, missing source docs, missing acceptance links or not ready for delivery implementation."
    }
  ],
  "lenses": [
    {
      "id": "doctrine-vs-spec-tree",
      "title": "Doctrine vs spec tree",
      "focus": "Compare generated product specs against the product-shaping README, file contracts, creation order, utilization order and precedence rules."
    },
    {
      "id": "release-source-of-truth",
      "title": "Release source of truth",
      "focus": "Compare SCOPE.md, DOMAIN_SPEC.md, ACCEPTANCE_CRITERIA.md and DELIVERABLES.md for contradiction, omission and scope drift."
    },
    {
      "id": "product-decision-integrity",
      "title": "Product decision integrity",
      "focus": "Compare OPEN_QUESTIONS.md and PRODUCT_DECISIONS.md against generated specs to ensure open questions remain visible and closed decisions are explicit."
    },
    {
      "id": "delivery-handoff",
      "title": "Delivery handoff",
      "focus": "Evaluate whether DELIVERABLES.md is the only implementation handoff, contains valid statuses and avoids task-level implementation detail."
    }
  ]
}
